{
  "$schema": "http://json-schema.org/draft-07/schema#",
  "$id": "archspec.schema.json",
  "title": "ArchitectureSpec",
  "description": "Structural specification of the system: components, responsibilities, data flow, and constraints. Version 1.0.0.",
  "type": "object",
  "required": [
    "version",
    "schemaVersion",
    "project",
    "goalSpecVersion",
    "overview",
    "components",
    "dataFlow",
    "constraints"
  ],
  "additionalProperties": false,

  "definitions": {

    "componentId": {
      "type": "string",
      "description": "kebab-case component identifier, e.g. 'search-service', 'api-gateway'.",
      "pattern": "^[a-z][a-z0-9-]*$"
    },

    "reqId": {
      "type": "string",
      "pattern": "^REQ-\\d{3}$"
    },

    "nfrId": {
      "type": "string",
      "pattern": "^NFR-\\d{3}$"
    }
  },

  "properties": {

    "version": {
      "type": "string",
      "description": "Semver version of this archspec document instance.",
      "pattern": "^\\d+\\.\\d+\\.\\d+$"
    },

    "schemaVersion": {
      "type": "string",
      "description": "Version of the ArchSpec schema this document conforms to. Must be '1.0.0'.",
      "const": "1.0.0"
    },

    "project": {
      "type": "string",
      "description": "Must match the project name in the corresponding GoalSpec.",
      "minLength": 1
    },

    "status": {
      "type": "string",
      "enum": ["draft", "review", "confirmed", "superseded"],
      "default": "draft"
    },

    "goalSpecVersion": {
      "type": "string",
      "description": "Version of the GoalSpec this architecture was designed against.",
      "pattern": "^\\d+\\.\\d+\\.\\d+$"
    },

    "dataSpecVersion": {
      "type": "string",
      "description": "Version of the DataSpec this architecture references. Optional if DataSpec not yet produced.",
      "pattern": "^\\d+\\.\\d+\\.\\d+$"
    },

    "apiSpecVersion": {
      "type": "string",
      "description": "Version of the ApiSpec this architecture references. Optional if ApiSpec not yet produced.",
      "pattern": "^\\d+\\.\\d+\\.\\d+$"
    },

    "overview": {
      "type": "object",
      "description": "High-level description of the system structure. Must be understandable without implementation knowledge.",
      "required": ["summary", "subsystems"],
      "additionalProperties": false,
      "properties": {
        "summary": {
          "type": "string",
          "description": "2–4 sentences describing the system structure, major subsystems, and how they interact.",
          "minLength": 30
        },
        "subsystems": {
          "type": "array",
          "description": "Named major subsystems. Each must correspond to one or more components.",
          "minItems": 1,
          "items": {
            "type": "object",
            "required": ["name", "purpose"],
            "additionalProperties": false,
            "properties": {
              "name": {
                "type": "string",
                "description": "Human-readable subsystem name.",
                "minLength": 1
              },
              "purpose": {
                "type": "string",
                "description": "One sentence describing what this subsystem does.",
                "minLength": 5
              },
              "componentRefs": {
                "type": "array",
                "description": "Component IDs that belong to this subsystem.",
                "items": { "$ref": "#/definitions/componentId" }
              }
            }
          }
        }
      }
    },

    "components": {
      "type": "array",
      "description": "All major architectural units. Each component has exclusive ownership of its responsibilities.",
      "minItems": 1,
      "items": {
        "type": "object",
        "required": ["id", "name", "purpose", "responsibilities"],
        "additionalProperties": false,
        "properties": {

          "id": { "$ref": "#/definitions/componentId" },

          "name": {
            "type": "string",
            "description": "Human-readable component name.",
            "minLength": 1
          },

          "purpose": {
            "type": "string",
            "description": "One sentence: what this component exists to do.",
            "minLength": 10
          },

          "responsibilities": {
            "type": "array",
            "description": "Exclusive behaviours owned by this component. No two components may share the same responsibility.",
            "minItems": 1,
            "items": {
              "type": "string",
              "minLength": 5
            }
          },

          "dependencies": {
            "type": "array",
            "description": "Component IDs this component depends on. Must reference real component IDs in this spec.",
            "items": { "$ref": "#/definitions/componentId" }
          },

          "reqRefs": {
            "type": "array",
            "description": "REQ-IDs from the GoalSpec that this component helps satisfy.",
            "items": { "$ref": "#/definitions/reqId" }
          },

          "nfrRefs": {
            "type": "array",
            "description": "NFR-IDs from the GoalSpec that this component is responsible for meeting.",
            "items": { "$ref": "#/definitions/nfrId" }
          },

          "visibility": {
            "type": "string",
            "description": "Whether this component is exposed externally or internal only.",
            "enum": ["external", "internal"],
            "default": "internal"
          },

          "notes": { "type": "string" }
        }
      }
    },

    "dataModel": {
      "type": "object",
      "description": "Reference to the canonical DataSpec. If a DataSpec exists, all entity definitions live there — do not duplicate them here.",
      "additionalProperties": false,
      "properties": {
        "dataSpecRef": {
          "type": "string",
          "description": "Filename or path of the authoritative dataspec JSON.",
          "minLength": 1
        },
        "notes": {
          "type": "string",
          "description": "Any architectural notes about the data model not captured in the DataSpec itself."
        }
      }
    },

    "apiContract": {
      "type": "object",
      "description": "Reference to the canonical ApiSpec. If an ApiSpec exists, all interface definitions live there — do not duplicate them here.",
      "additionalProperties": false,
      "properties": {
        "apiSpecRef": {
          "type": "string",
          "description": "Filename or path of the authoritative apispec JSON.",
          "minLength": 1
        },
        "authStrategy": {
          "type": "string",
          "description": "How consumers authenticate with the system, e.g. 'API key in Authorization header', 'local Unix socket — no auth'.",
          "minLength": 5
        },
        "notes": {
          "type": "string",
          "description": "Any architectural notes about the API not captured in the ApiSpec itself."
        }
      }
    },

    "dataFlow": {
      "type": "array",
      "description": "Named flows describing how data moves through the system. Each flow names a source component, optional transforms, and a sink component.",
      "minItems": 1,
      "items": {
        "type": "object",
        "required": ["id", "name", "steps"],
        "additionalProperties": false,
        "properties": {
          "id": {
            "type": "string",
            "description": "Stable kebab-case flow identifier, e.g. 'query-routing-flow'.",
            "pattern": "^[a-z][a-z0-9-]*$"
          },
          "name": {
            "type": "string",
            "description": "Human-readable flow name.",
            "minLength": 1
          },
          "description": {
            "type": "string",
            "description": "Optional prose summary of this flow."
          },
          "reqRefs": {
            "type": "array",
            "description": "REQ-IDs this flow implements.",
            "items": { "$ref": "#/definitions/reqId" }
          },
          "steps": {
            "type": "array",
            "description": "Ordered steps in this flow. Each step names the acting component and what happens.",
            "minItems": 2,
            "items": {
              "type": "object",
              "required": ["componentRef", "action"],
              "additionalProperties": false,
              "properties": {
                "componentRef": {
                  "$ref": "#/definitions/componentId",
                  "description": "The component performing this step."
                },
                "action": {
                  "type": "string",
                  "description": "What the component does at this step.",
                  "minLength": 5
                },
                "dataRef": {
                  "type": "string",
                  "description": "Optional: name of the entity or payload moving through this step."
                },
                "notes": { "type": "string" }
              }
            }
          }
        }
      }
    },

    "constraints": {
      "type": "array",
      "description": "Architectural limitations and hard requirements. Each must be independently verifiable.",
      "minItems": 1,
      "items": {
        "type": "object",
        "required": ["id", "description"],
        "additionalProperties": false,
        "properties": {
          "id": {
            "type": "string",
            "description": "Stable constraint identifier, e.g. 'CON-001'.",
            "pattern": "^CON-\\d{3}$"
          },
          "description": {
            "type": "string",
            "description": "The constraint in plain language.",
            "minLength": 10
          },
          "rationale": {
            "type": "string",
            "description": "Why this constraint exists."
          },
          "nfrRefs": {
            "type": "array",
            "description": "NFR-IDs this constraint helps satisfy.",
            "items": { "$ref": "#/definitions/nfrId" }
          }
        }
      }
    }
  }
}
